{
  "$schema": "https://json-schema.org/draft/2020-12/schema",
  "title": "Agent Defaults",
  "type": "object",
  "additionalProperties": false,
  "properties": {
    "$schema": { "type": "string" },
    "description": { "type": "string" },
    "provider": { "type": ["string", "null"] },
    "model": { "type": ["string", "null"] },
    "thinking": { "type": ["string", "null"], "enum": ["off", "minimal", "low", "medium", "high", "xhigh", "max", null] },
    "tools": { "type": ["array", "null"], "items": { "type": "string" } },
    "sessionDir": { "type": ["string", "null"] }
  },
  "required": ["provider", "model"]
}
